{
  "schema_version": 1,
  "model": {
    "package": "qwen25_72b",
    "hf_id": "Qwen/Qwen2.5-72B-Instruct",
    "hf_revision": "495f39366efef23836d0cfae4fbe635880d2be31"
  },
  "status": "experimental",
  "software": {
    "tt_transformers": "2.0.0.dev0",
    "ttnn": "0.79.0",
    "python": [
      "3.10",
      "3.12"
    ],
    "torch": "2.11.0",
    "transformers": "5.12.1"
  },
  "hardware": [
    {
      "architecture": "wormhole",
      "sku": "T3K",
      "mesh": "1x8",
      "tp": 8,
      "dp": 1
    }
  ],
  "assets": {
    "reference_root": "tests/assets/reference_outputs/qwen25_72b",
    "hf_assets_external": true,
    "offline_environment": [
      "HF_HOME",
      "HF_HUB_OFFLINE=1",
      "TRANSFORMERS_OFFLINE=1"
    ],
    "tt_cache_writable": true,
    "remote_code_default": false,
    "cwd_relative_cache_default": false,
    "cache_resolver": "tt_transformers.cache_environment.resolve_model_cache_path",
    "tt_cache_path_semantics": "append topology exactly once"
  },
  "known_gaps": [
    "Current regression evidence does not qualify the complete declared model contract",
    "non-T3K meshes",
    "DP greater than 1",
    "any geometry not declared in support.json"
  ],
  "validation": {
    "date": null,
    "git_sha": null,
    "evidence": []
  },
  "limits": {
    "source_proven": [
      "Benchmark cases cover active batch 1 or 32",
      "standard/CI sequence budgets are 1024/2048",
      "weights and KV require T3K TP8",
      "all retained DP cases capacity-skip"
    ]
  },
  "features": {
    "device_sampling": "Host and on-device top-k paths exist; the performance path defaults to on_device_topk.",
    "trace": "case_and_topology_specific"
  }
}
