{
  "schema_version": 1,
  "model": {
    "package": "deepseek_r1_distill_qwen_14b",
    "hf_id": "deepseek-ai/DeepSeek-R1-Distill-Qwen-14B",
    "hf_revision": "1df8507178afcc1bef68cd8c393f61a886323761"
  },
  "status": "experimental",
  "software": {
    "tt_transformers": "2.0.0.dev0",
    "ttnn": "0.79.0",
    "python": [
      "3.10",
      "3.12"
    ],
    "torch": "2.11.0",
    "transformers": "5.12.1"
  },
  "hardware": [
    {
      "architecture": "wormhole",
      "sku": "N300",
      "mesh": "1x2",
      "tp": 2,
      "dp": 1
    },
    {
      "architecture": "wormhole",
      "sku": "T3K",
      "mesh": "1x8",
      "tp": 8,
      "dp": 1
    },
    {
      "architecture": "wormhole",
      "sku": "T3K",
      "mesh": "1x8",
      "tp": 4,
      "dp": 2
    },
    {
      "architecture": "wormhole",
      "sku": "T3K",
      "mesh": "1x8",
      "tp": 2,
      "dp": 4
    }
  ],
  "assets": {
    "reference_root": "tests/assets/reference_outputs/deepseek_r1_distill_qwen_14b",
    "hf_assets_external": true,
    "offline_environment": [
      "HF_HOME",
      "HF_HUB_OFFLINE=1",
      "TRANSFORMERS_OFFLINE=1"
    ],
    "tt_cache_writable": true,
    "remote_code_default": false,
    "cwd_relative_cache_default": false,
    "cache_resolver": "tt_transformers.cache_environment.resolve_model_cache_path",
    "tt_cache_path_semantics": "append topology exactly once"
  },
  "known_gaps": [
    "Current regression evidence does not qualify the complete declared model contract",
    "N150/TP1",
    "N300 accuracy eval-32 and batch-32-ci",
    "any geometry not declared in support.json"
  ],
  "validation": {
    "date": null,
    "git_sha": null,
    "evidence": []
  },
  "limits": {
    "source_proven": [
      "Benchmark cases cover active batch 1 or 32",
      "standard/CI sequence budgets are 1024/2048; retained DP smokes reach 4096",
      "TP1 is rejected; supported model lanes are TP2, TP4, or TP8",
      "N300 accuracy eval-32 and batch-32-ci are explicitly DRAM-infeasible"
    ]
  },
  "features": {
    "device_sampling": "Host and on-device top-k paths exist; the benchmark default is on_device_topk.",
    "trace": "case_and_topology_specific"
  }
}
