{
  "schema_version": 1,
  "model": {
    "package": "llama33_70b",
    "hf_id": "meta-llama/Llama-3.3-70B-Instruct",
    "hf_revision": "6f6073b423013f6a7d4d9f39144961bfbfbc386b"
  },
  "status": "experimental",
  "software": {
    "tt_transformers": "2.0.0.dev0",
    "ttnn": "0.79.0",
    "python": [
      "3.10",
      "3.12"
    ],
    "torch": "2.11.0",
    "transformers": "5.12.1"
  },
  "hardware": [
    {
      "architecture": "wormhole",
      "sku": "T3K",
      "mesh": "1x8",
      "tp": 8,
      "dp": 1
    },
    {
      "architecture": "blackhole",
      "sku": "P150_X4 required logical target; code accepts physical P300_X2 alias with distinct provenance",
      "mesh": "1x4",
      "tp": 4,
      "dp": 1
    }
  ],
  "assets": {
    "reference_root": "tests/assets/reference_outputs/llama33_70b",
    "hf_assets_external": true,
    "offline_environment": [
      "HF_HOME",
      "HF_HUB_OFFLINE=1",
      "TRANSFORMERS_OFFLINE=1"
    ],
    "tt_cache_writable": true,
    "remote_code_default": false,
    "cwd_relative_cache_default": false,
    "cache_resolver": "tt_transformers.cache_environment.resolve_model_cache_path",
    "tt_cache_path_semantics": "append topology exactly once"
  },
  "known_gaps": [
    "Current regression evidence does not qualify the complete declared model contract",
    "DP greater than 1",
    "noncanonical P150x4 orientations",
    "unproven 32K context",
    "any geometry not declared in support.json"
  ],
  "validation": {
    "date": null,
    "git_sha": null,
    "evidence": []
  },
  "limits": {
    "source_proven": [
      "Benchmark cases cover active batch 1 or 32",
      "P150x4 contract buckets are 4096 for token accuracy and 1024 for eval/performance cases",
      "one model replica requires the full declared lane; every collected DP>1 case skips",
      "P150x4 long-prefill coverage is not established"
    ]
  },
  "features": {
    "device_sampling": "Host and on-device top-k paths exist; capability contracts distinguish trace none/decode_only/all.",
    "trace": "case_and_topology_specific"
  }
}
