{
  "schema_version": 1,
  "model": {
    "package": "qwen3_32b",
    "hf_id": "Qwen/Qwen3-32B",
    "hf_revision": "9216db5781bf21249d130ec9da846c4624c16137"
  },
  "status": "experimental",
  "software": {
    "tt_transformers": "2.0.0.dev0",
    "ttnn": "0.79.0",
    "python": [
      "3.10",
      "3.12"
    ],
    "torch": "2.11.0",
    "transformers": "5.12.1"
  },
  "hardware": [
    {
      "architecture": "wormhole",
      "sku": "T3K",
      "mesh": "1x8",
      "tp": 8,
      "dp": 1
    },
    {
      "architecture": "blackhole",
      "sku": "P150_X4 required logical target; code accepts physical P300_X2 alias with distinct provenance",
      "mesh": "1x4",
      "tp": 4,
      "dp": 1
    }
  ],
  "assets": {
    "reference_root": "tests/assets/reference_outputs/qwen3_32b",
    "hf_assets_external": true,
    "offline_environment": [
      "HF_HOME",
      "HF_HUB_OFFLINE=1",
      "TRANSFORMERS_OFFLINE=1"
    ],
    "tt_cache_writable": true,
    "remote_code_default": false,
    "cwd_relative_cache_default": false,
    "cache_resolver": "tt_transformers.cache_environment.resolve_model_cache_path",
    "tt_cache_path_semantics": "append topology exactly once"
  },
  "known_gaps": [
    "Current regression evidence does not qualify the complete declared model contract",
    "P100/P150/P300 single/two-die model paths",
    "DP greater than 1",
    "noncanonical P150x4 orientations",
    "any geometry not declared in support.json"
  ],
  "validation": {
    "date": null,
    "git_sha": null,
    "evidence": []
  },
  "limits": {
    "source_proven": [
      "Benchmark cases cover active batch 1 or 32",
      "P150x4 buckets are 4096 for token accuracy, 1024 for eval, and 2048 for batch-32-ci",
      "model lanes require at least TP4; all DP cases capacity-skip",
      "P150x4 batched prefill remains disabled unless exact-token cross-cardinality invariance is proven"
    ]
  },
  "features": {
    "device_sampling": "Host and on-device top-k paths exist; P150x4 includes a seeded exact-token cross-cardinality diagnostic.",
    "trace": "case_and_topology_specific"
  }
}
