{
  "schema_version": 1,
  "model": {
    "package": "qwen25_7b",
    "hf_id": "Qwen/Qwen2.5-7B-Instruct",
    "hf_revision": "a09a35458c702b33eeacc393d103063234e8bc28"
  },
  "status": "experimental",
  "software": {
    "tt_transformers": "2.0.0.dev0",
    "ttnn": "0.79.0",
    "python": [
      "3.10",
      "3.12"
    ],
    "torch": "2.11.0",
    "transformers": "5.12.1"
  },
  "hardware": [
    {
      "architecture": "wormhole",
      "sku": "N300",
      "mesh": "1x2",
      "tp": 2,
      "dp": 1
    },
    {
      "architecture": "wormhole",
      "sku": "T3K",
      "mesh": "1x8",
      "tp": 2,
      "dp": 4
    }
  ],
  "assets": {
    "reference_root": "tests/assets/reference_outputs/qwen25_7b",
    "hf_assets_external": true,
    "offline_environment": [
      "HF_HOME",
      "HF_HUB_OFFLINE=1",
      "TRANSFORMERS_OFFLINE=1"
    ],
    "tt_cache_writable": true,
    "remote_code_default": false,
    "cwd_relative_cache_default": false,
    "cache_resolver": "tt_transformers.cache_environment.resolve_model_cache_path",
    "tt_cache_path_semantics": "append topology exactly once"
  },
  "known_gaps": [
    "Current regression evidence does not qualify the complete declared model contract",
    "N150",
    "ordinary T3K/TG TP",
    "DP factors other than T3K DP4",
    "any geometry not declared in support.json"
  ],
  "validation": {
    "date": null,
    "git_sha": null,
    "evidence": []
  },
  "limits": {
    "source_proven": [
      "Benchmark cases cover active batch 1 or 32",
      "standard/CI budgets are 1024/2048",
      "ordinary execution is N300 TP2; T3K DP4 partitions into four TP2 lanes",
      "N150 overflows the source L1 capacity guard"
    ]
  },
  "features": {
    "device_sampling": "Host and on-device top-k paths exist; the benchmark default is host sampling.",
    "trace": "case_and_topology_specific"
  }
}
